{
  "schemaVersion": "codex-chef.brain.v1",
  "vaultName": "CodexChefBrain",
  "storageMode": "local-markdown",
  "writePolicy": "preview-required",
  "semanticMemory": {
    "enabled": false,
    "provider": "none"
  },
  "directories": {
    "inbox": "00-inbox",
    "commandCenter": "10-command-center",
    "goals": "20-goals",
    "projects": "30-projects",
    "knowledge": "40-knowledge",
    "research": "50-research",
    "decisions": "60-decisions",
    "personal": "70-personal",
    "memory": "80-memory",
    "archive": "90-archive"
  }
}
